branch_id	primary_variables	reciprocity_implementation	current_status	required_before_solve	forbidden_promotion
C01	conformal metric class only	phi is a derived local readout of a separately realized reciprocal base ratio	OPEN_BRANCH	derive the slot map representative handling and allowed variations	Do not assume every metric admits one smooth global phi readout.
C02	conformal metric plus independent signed phi	metric-phi relation imposed by a separately derived equation or constraint	OPEN_BRANCH	specify independent variations constraint propagation and boundary data	Do not add a scalar action because an independent phi is convenient.
C03	coframe plus reciprocal character reduction	D(phi) acts on a supplied internal/coframe pair	OPEN_BRANCH	specify physical soldering local Lorentz quotient and global continuation	Do not call the internal pair a spacetime plane automatically.
C04	metric plus supplied reciprocal rank-two projector	projector identifies the reciprocal plane while phi acts within it	CONDITIONAL_DIAGNOSTIC_BRANCH	specify origin integrability/type change and transport authority	Projector compatibility is not projector selection.
C05	unrestricted metric plus multiplier or hard reciprocal constraint	constraint enforces a declared reciprocal relation off shell	OPEN_BRANCH	specify multiplier fields constraint class and full unrestricted metric variation	Do not restrict the metric before variation and lose normal equations.
C06	pre-scale conformal geometry then selected representative	two-stage branch separates CSN-invariant and post-scale variables	OPEN_BRIDGE_BRANCH	specify native representative map scale origin boundary and why the second law follows	Do not infer EH from C2 or shared curvature.
C07	independent connection or torsion plus metric/coframe	reciprocity may constrain connection holonomy or nonmetricity	OPEN_FIELD_CENSUS_BRANCH	source-authorized field and action/admissibility rule	Do not erase this branch merely because Levi-Civita geometry is canonical per representative.
