route_id	density_role	mass_status	volume_status	circularity_status	selection_authority	missing_object
D01_OBSERVED_DENSITY_INPUT	externally supplied observational anchor	not derived by this route	may use a chosen observational volume	NONCIRCULAR_BUT_EXTERNAL	COMPARISON_OR_CALIBRATION_ONLY	native mass and volume from the same UDT solution
D02_CONDITIONAL_CARRIER_READOUT	mass divided by volume after adopting a conditional carrier/action/readout	CONDITIONAL	completion-dependent	TYPE_CORRECT_ONLY_IF_ALL_PREMISES_TRAVEL	CONDITIONAL_BRANCH_DIAGNOSTIC_NOT_FOUNDATION_SELECTOR	native carrier/action/source/boundary charge
D03_NATIVE_SIMULTANEOUS_FIXED_POINT	rho_solution=M_native[g,fields]/V_proper[g] solved with geometry boundary and bootstrap	OPEN_NATIVE_OBJECT_REQUIRED	GLOBAL_COMPLETION_DEPENDENT_BUT_GEOMETRICALLY_DEFINABLE	DESIRED_NONCIRCULAR_SIMULTANEOUS_CLOSURE	POTENTIAL_FUTURE_EIGENVALUE_OR_BRANCH_SELECTOR	off-shell native mass functional plus varied global closure and response map
D04_DIMENSIONLESS_COMPACTNESS_LOOP	G rho Xmax^2/c^2 equivalent to G M/(c^2 Xmax) for rho=M/V with V proportional to Xmax^3	symbolic unknown	homogeneous finite-cell scaling	RANK_ONE_IF_NO_INDEPENDENT_DIMENSIONAL_DATUM	CAN_SELECT_AT_MOST_DIMENSIONLESS_BRANCH_OR_COMPACTNESS	independent scale-breaking datum or process
D05_ASSEMBLY_ATLAS_CONTRIBUTION	provides alternative proper-volume and boundary geometries for a later simultaneous solve	NOT_SUPPLIED_BY_GEOMETRY_ATLAS	branch-dependent candidate object	NO_DENSITY_FED_BACK_IN_CURRENT_ATLAS	NONE_UNTIL_NATIVE_MASS_BOOTSTRAP_EXISTS	join from completion-specific volume/boundary to native matter functional
