id	question	result	evidence
A01	Were every boundary condition field choice coupling and fixed value tagged?	PASS	PREREGISTRATION.md fixes the complete premise ledger; no numeric physical value or extra boundary datum enters
A02	Do any acceptance checks filter configurations by shape smoothness expected behavior or merit?	PASS	All checks test provenance coverage branch separation deterministic identity or declared equivalence; all 89 P02 witnesses remain
A03	Is the question observing or targeting?	OBSERVING_METRIC_LED	The question asks how each cited premise acts on the frozen atlas; no desired physical output is in the candidate universe
A04	Was the bounded solution space classified rather than a sought witness reported?	PASS_BOUNDED	All 36 premises 7 realization branches 89 P02 strata 24 effects 14 inconsistent combinations and 12 countermodels are recorded
A05	Does any machine gate judge scientific merit?	NO	The verifier rejects hidden ranking and checks only provenance honesty algebra coverage and immutability
