family_id	family	foundation_status	exact_consequence_or_candidate	selector_ruling	missing_or_limit
B01	CSN_NOETHER_TRACE_IDENTITY	CONDITIONAL_ON_CHOSEN_CSN_INVARIANT_ACTION	2 g_ab E^ab + sum_i w_i Phi_i E_i = 0 for algebraic-weight field transformations, up to the boundary identity	CONDITIONAL_GAUGE_IDENTITY	Inhomogeneous field transformations may add derivatives of Euler expressions; neither form sets the independent reciprocal-phi or angular trace-free projection to zero
B02	RECIPROCAL_PHI_TANGENT_EQUATION	DERIVED_CONDITIONAL	-E_t + E_r = 0 in logarithmic diagonal components	INDEPENDENT_NOT_FORCED	Reciprocity defines the tangent but no current Euler operator sets its projection to zero
B03	ANGULAR_TRACEFREE_EQUATION	OPEN	E_2-E_3=0 for a diagonal shear tile; covariantly E_AB^TF=0	INDEPENDENT_NOT_FORCED	CSN removes only common trace and leaves angular shape free
B04	BOOTSTRAP_AFTER_SOLUTION_PREDICATE	OWNER_STATED_WORKING	B[g,Phi] lies in the admissible narrow window after local equations and closure exist	CURRENT_SEMANTICS_NO_LOCAL_OPERATOR	Filters solutions but supplies no pointwise phi-angular equation
B05	BOOTSTRAP_VARIED_GLOBAL_CONSTRAINT	FUTURE_CONDITIONAL	E_ab + eta delta B/delta g^ab = 0	FORM_ONLY_UNDERDETERMINED	B, fields, multiplier domain, and boundary variation are not supplied
B06	BOOTSTRAP_REPRESENTATIVE_SELECTION	FUTURE_CONDITIONAL	E_ab plus a normal-to-section term determined by Sigma	FORM_ONLY_UNDERDETERMINED	Sigma:[g]_CSN->g_* and its normal equation are not supplied
B07	LOCAL_EIKONAL_MINIMALITY	CONDITIONAL_CLASS	g^ab partial_a phi partial_b phi = 0 up to a nowhere-zero coefficient	UNIQUE_CONDITIONAL	Requires an independent weight-zero phi plus local first-jet scalar homogeneous-quadratic minimality and a nowhere-zero coefficient; none is selected by current bootstrap/CSN
B08	WEYL_SPECIALITY_DISCRIMINANT	CONDITIONAL_4D	I^3-27J^2=0	CSN_COMPATIBLE_NOT_SELECTED	Includes II,D,III,N,O; D has two repeated PNDs and in O the Weyl tensor vanishes so curvature selects no direction
B09	PHI_WEYL_ALIGNMENT	FORMAL_TARGET	d phi null and its line equals a repeated Weyl PND	NO_FOUNDATION_OPERATOR	Requires both target equations and an alignment law; no frozen source supplies them
B10	CONDITIONAL_C2_BACH	UNIQUE_CONDITIONAL_ACTION_CLASS	B_ab=0	DOES_NOT_FORCE_TARGET	Exact reciprocal Ricci-flat Kasner witness is Bach-flat with timelike d phi and Petrov I
B11	CONDITIONAL_POST_SCALE_EH	CONDITIONAL_ACTION_CLASS	G_ab=0 in the zero-Lambda vacuum comparison tile	DOES_NOT_FORCE_TARGET	The same reciprocal Kasner coordinate representative is Ricci-flat with timelike d phi and Petrov I
B12	FINITE_CELL_GLOBAL_CONTINUATION	OPEN	Seal parity and global narrow-density admissibility	NO_CURRENT_POINTWISE_SELECTOR	Normal derivative, full boundary functional, total-density functional, and global solution are open
