id	branch	current_evidence	causal_or_domain_status	L01_operator_coverage	L02_operator_coverage	selected_by_current_UDT	missing_data
T01	NON_NULL_FIXED_MIRROR_FOLD	conditional recorded fold plus static seal	non_null only in recorded branch; global identity open	exact h,K,E,Pi_h,corner split in Gaussian normal diagnostic	raw EH current; non_null decomposition possible but no native completion	NO	global identification full coframe tangents orientation corner functional
T02	NULL_CAUSAL_HORIZON	conditional WRL wall is regular null horizon	crossing quotient or observational-domain ontology open	P05 covariant raw current only; non_null split inapplicable	P05 covariant raw current only; null polarization not derived	NO	null generators normalization auxiliary null direction joints and terminality
T03	MOVING_OR_TYPE_CHANGING_BOUNDARY	open retained branch	OPEN	covariant raw current only	covariant raw current only	NO	embedding variation causal transition data normals and corner/joint law
T04	QUOTIENT_CROSSING_OR_INTERNAL_MATCH	finite mirror and regular horizon admit inequivalent global readings	OPEN	boundary versus matching interpretation unresolved	boundary versus matching interpretation unresolved	NO	cover involution soldering junction orientation and action
T05	NO_SELECTED_LOCAL_REALIZATION	global Xmax remains output target	OPEN	no evaluable complete boundary problem	no evaluable complete boundary problem	NO_REALIZATION_SELECTED	complete global solution and local/global boundary join
