id	realization	quadratic_form_or_role	inversion_map	involution	metric_compatibility	provenance	ruling
B01	RAW_SWAP_DIAGONAL_READOUT	eta=diag(-1,1) on declared clock/radial slots	J	YES	J^T eta J=-eta; negative factor	conditional diagonal readout plus founded dual-pairing matrix	NOT_POSITIVE_CSN_LORENTZIAN_ISOMETRY
B02	GENERAL_CONSTANT_DIAGONAL_READOUT	eta=diag(-1,1); F_b=[[0,b],[1/b,0]]	F_b D(phi) F_b^-1=D(-phi)	YES for b nonzero	F_b^T eta F_b=diag(1/b^2,-b^2); impossible positive conformal eta	full real constant solution of conjugation plus involution	NO_REAL_CONSTANT_PHYSICAL_REFLECTION_IN_THIS_READOUT
B03	DUAL_PAIRING_AS_NULL_METRIC	K=[[0,1],[1,0]]	F_b=[[0,b],[1/b,0]]	YES	F_b^T K F_b=K	CHOSE physical interpretation of founded pairing; original source calls K dual pairing	CONTINUUM_CONDITIONAL_O11_REFLECTIONS
B04	BALANCED_NULL_BASIS_SWAP	K physical and b=1	J	YES	K-isometry; after Hadamard basis J becomes diag(1,-1)	adds K-as-metric/null-slot interpretation and balanced reflection axis	CONDITIONAL_PHYSICAL_BLOCK_WITNESS
B05	FIELD_DEPENDENT_DIAGONAL_TRANSPORT	eta readout; T(phi)=D(-phi)D(phi)^-1=D(-2phi)	T(phi)D(phi)=D(-phi)	T(-phi)T(phi)=I	T^T eta T not conformal to eta except phi=0	category-A bundle transport identity; not a symmetry supplied by UDT	TAUTOLOGICAL_TRANSPORT_NOT_ISOMETRY
B06	BASIS_CHANGED_K_REALIZATION	H^T K H=diag(1,-1)	H^T D H is a Lorentz boost; H^T J H is a reflection	YES	Lorentz isometry in transformed quadratic form	exact basis algebra; physical identification of H^T q as time/space is CHOSE	CONDITIONAL_BASIS_REALIZATION_NOT_UNIQUE
B07	COMPLEX_REPAIR	i times raw swap or imaginary common factor	can change the minus sign algebraically	CONDITIONAL	complex coframe not a real Lorentzian metric map	preregistered excluded physical class	REJECTED_NONREAL
