candidate	geometric_role	redshift_join	areal_or_optical_join	SNe_status	reason
PROJECTIVE_PAIR_TRANSFORM	BOUNDED_PAIR_METRIC_TRANSFORM	OPEN	OPEN	NOT_EVALUABLE	pair distance is not automatically D_A or d_L
WRL_PROPER_PAIR_TRANSFORM	LOCAL_PROPER_RADIAL_PROFILE_AND_CONDITIONAL_PAIR_TRANSFORM	REGISTERED_LOCAL_STATIC	NOT_THE_SCORED_D_A	NOT_EVALUABLE_AS_PAIR_PROFILE	existing SNe score uses areal r not proper distance
B19_ROUND_PAIR_TRANSFORM	CONDITIONAL_ANGULAR_DEPTH_PAIR_TRANSFORM	ABSENT_CONSTANT_LAPSE	OPEN	NOT_EVALUABLE	clock/angular solder and SNe readout absent
FC12_OPEN	FREE_PROFILE_CONTROL	ABSENT_CONSTANT_LAPSE	OPEN	NOT_EVALUABLE	A(phi) unselected
TEMPORAL_PHI_SEPARATION_FAMILY	CONDITIONAL_EQUAL_PHI_OBSERVER_DISTANCE	OPEN	OPEN	NOT_EVALUABLE	representative and global branch open
WRL_AREAL_OPTICAL_READOUT	STATIC_CENTERED_AREAL_PLUS_CLOCK_PLUS_OPTICS	1+z=exp(phi)	D_A=r=X*(1-exp(-2phi)); d_L=(1+z)^2*D_A	EVALUABLE_EXISTING	complete registered conditional readout
PROJECTIVE_AREAL_J1_READOUT	REGISTERED_PROJECTIVE_COMPARATOR	1+z=exp(phi)	D_A=X*tanh(phi); d_L=(1+z)^2*D_A	EVALUABLE_EXISTING_COMPARATOR	complete registered conditional comparator
RETIRED_P_ELL	IMPOSED_JOIN	RETIRED	RETIRED	PROHIBITED	prior imposition finding
