claim	status	scope
three bounded transforms preserve metric axioms	DERIVED_CONDITIONAL_ON_SUPPLIED_BASE_METRIC	positive X kappa and registered profiles
transformed distances are local path lengths	REFUTED_IN_GENERAL	strict concavity makes subdivision sum larger
profile selected by pair-metric validity	REFUTED	all three pass
WR-L proper profile is the successful SNe law	REFUTED_CONFLATION	SNe uses WR-L areal radius plus clock and optics
global physical Xmax	OPEN	base metric event pairing profile and scale unselected
BAO CMB black-hole consequences	OPEN_OUT_OF_SCOPE	no inference from this SNe replay
